{
  "$schema": "https://json-schema.org/draft/2020-12/schema",
  "$id": "https://falak.sh/agent-protocol/commands/docker.run.schema.json",
  "title": "docker.run \u2014 ensure a named container runs with exactly this spec (recreated when spec hash changes)",
  "type": "object",
  "additionalProperties": false,
  "required": [
    "name",
    "image"
  ],
  "properties": {
    "name": {
      "type": "string",
      "pattern": "^[a-zA-Z0-9][a-zA-Z0-9_.-]+$"
    },
    "image": {
      "type": "string",
      "minLength": 1
    },
    "pull": {
      "enum": [
        "always",
        "missing",
        "never"
      ],
      "default": "missing"
    },
    "auth": {
      "type": "object",
      "additionalProperties": false,
      "required": [
        "username",
        "password"
      ],
      "properties": {
        "username": {
          "type": "string"
        },
        "password": {
          "type": "string"
        },
        "server": {
          "type": "string"
        }
      }
    },
    "env": {
      "type": "object",
      "propertyNames": {
        "pattern": "^[A-Za-z_][A-Za-z0-9_]*$"
      },
      "additionalProperties": {
        "type": "string"
      }
    },
    "command": {
      "type": "array",
      "items": {
        "type": "string"
      }
    },
    "entrypoint": {
      "type": "array",
      "items": {
        "type": "string"
      }
    },
    "user": {
      "type": "string"
    },
    "ports": {
      "type": "array",
      "items": {
        "type": "object",
        "additionalProperties": false,
        "required": [
          "container_port"
        ],
        "properties": {
          "host_ip": {
            "type": "string",
            "default": "127.0.0.1"
          },
          "host_port": {
            "type": "integer",
            "minimum": 1,
            "maximum": 65535
          },
          "container_port": {
            "type": "integer",
            "minimum": 1,
            "maximum": 65535
          },
          "protocol": {
            "enum": [
              "tcp",
              "udp"
            ],
            "default": "tcp"
          }
        }
      }
    },
    "volumes": {
      "type": "array",
      "items": {
        "type": "object",
        "additionalProperties": false,
        "required": [
          "source",
          "target"
        ],
        "properties": {
          "source": {
            "type": "string"
          },
          "target": {
            "type": "string",
            "pattern": "^/"
          },
          "read_only": {
            "type": "boolean",
            "default": false
          }
        }
      }
    },
    "network": {
      "type": "string"
    },
    "networks": {
      "type": "array",
      "description": "Existing networks the container joins besides its own (waited for briefly, then the command fails; a network with `compose` is created with Compose's labels when missing). A compose service run as its own site joins its stack's network under its service name.",
      "maxItems": 8,
      "items": {
        "type": "object",
        "additionalProperties": false,
        "required": [
          "name"
        ],
        "properties": {
          "name": {
            "type": "string",
            "pattern": "^[a-zA-Z0-9][a-zA-Z0-9_.-]{0,127}$"
          },
          "aliases": {
            "type": "array",
            "maxItems": 8,
            "items": {
              "type": "string",
              "pattern": "^[a-zA-Z0-9][a-zA-Z0-9_.-]{0,62}$"
            }
          },
          "compose": {
            "type": "object",
            "additionalProperties": false,
            "required": [
              "project",
              "network"
            ],
            "description": "The compose project and network key that own this network (feature docker.networks.create): created with labels com.docker.compose.project / com.docker.compose.network when missing, so the project's `docker compose up` adopts it.",
            "properties": {
              "project": {
                "type": "string",
                "pattern": "^[a-z0-9][a-z0-9_-]{0,62}$"
              },
              "network": {
                "type": "string",
                "pattern": "^[a-zA-Z0-9][a-zA-Z0-9_.-]{0,62}$"
              }
            }
          },
          "environment": {
            "type": "boolean",
            "default": false,
            "description": "feature db.instances: a Falak environment network (name falak-env-<id>): created when missing instead of waited for"
          }
        }
      }
    },
    "labels": {
      "type": "object",
      "additionalProperties": {
        "type": "string"
      }
    },
    "restart_policy": {
      "enum": [
        "no",
        "always",
        "unless-stopped",
        "on-failure"
      ],
      "default": "unless-stopped"
    },
    "memory_bytes": {
      "type": "integer",
      "minimum": 0,
      "description": "Hard memory limit; swap is capped at the same value (no swap on top), so a service over its limit is OOM-killed"
    },
    "cpus": {
      "type": "number",
      "minimum": 0
    },
    "memory_reservation_bytes": {
      "type": "integer",
      "minimum": 0,
      "description": "Soft limit: under memory pressure the kernel reclaims the container down to it (Docker MemoryReservation); at most memory_bytes"
    },
    "pids_limit": {
      "type": "integer",
      "minimum": 0,
      "description": "Most processes/threads in the container (0 = unlimited)"
    },
    "max_restarts": {
      "type": "integer",
      "minimum": 0,
      "description": "Restart attempts with restart_policy on-failure (0 = unlimited)"
    },
    "log": {
      "type": "object",
      "additionalProperties": false,
      "required": [
        "max_size_mb"
      ],
      "description": "Caps the container's log: json-file driver with max-size / max-file (otherwise the daemon's default driver)",
      "properties": {
        "max_size_mb": {
          "type": "integer",
          "minimum": 1,
          "maximum": 10240
        },
        "max_files": {
          "type": "integer",
          "minimum": 1,
          "maximum": 100,
          "default": 1
        }
      }
    },
    "oom_score_adj": {
      "type": "integer",
      "minimum": -1000,
      "maximum": 1000,
      "description": "OOM preference: negative values are killed last by the host's OOM killer (Falak sends -500 for `protect`)"
    },
    "secret_files": {
      "type": "array",
      "items": {
        "type": "object",
        "additionalProperties": false,
        "required": [
          "name",
          "content"
        ],
        "properties": {
          "name": {
            "type": "string",
            "pattern": "^[A-Za-z_][A-Za-z0-9_]*$",
            "description": "File name under /run/secrets (the variable's name)"
          },
          "content": {
            "type": "string",
            "description": "secret"
          }
        }
      },
      "description": "Secrets passed as files instead of env (the site's secrets mode `files`): written to /run/falak/secrets/<container>/<name> (tmpfs; parent 0700 root; files 0444 in a 0555 directory, or 0400/0500 owned by a numeric `user`) and bind-mounted read-only at /run/secrets, so `docker inspect` never shows them. A variable of the same name in env is dropped. After a reboot the container cannot start until site.env.write restores the files (heartbeat `missing_secrets`)."
    },
    "mask": {
      "type": "array",
      "items": {
        "type": "string",
        "pattern": "^[A-Za-z_][A-Za-z0-9_]*$"
      },
      "uniqueItems": true,
      "description": "Names of the secret variables in this payload. The agent looks their values up in the payload (env maps, dotenv content) and masks them, plus their base64 and URL-encoded forms, as \u2022\u2022\u2022\u2022 in the command's output, error and result. Values shorter than 6 bytes are not masked."
    }
  },
  "$defs": {
    "result": {
      "type": "object",
      "additionalProperties": false,
      "required": [
        "changed",
        "container_id"
      ],
      "properties": {
        "changed": {
          "type": "boolean",
          "description": "true when the host state was modified"
        },
        "container_id": {
          "type": "string"
        }
      }
    }
  }
}
